{
  "$schema": "../../schemas/benchmark.schema.json",
  "id": "nbody",
  "name": "N-body simulation",
  "version": 1,
  "description": "Deterministic gravitational simulation exercising numeric computation, tight loops, and floating-point arithmetic.",
  "inputFormat": "json",
  "outputFormat": "json",
  "checker": {
    "task": "nbody",
    "timeoutMilliseconds": 30000
  },
  "sizes": {
    "small": {
      "dataset": "small.json",
      "warmupIterations": 1,
      "measuredIterations": 5
    },
    "medium": {
      "dataset": "medium.json",
      "warmupIterations": 3,
      "measuredIterations": 10
    },
    "large": {
      "dataset": "large.json",
      "warmupIterations": 3,
      "measuredIterations": 10
    }
  },
  "metrics": ["kernelTime"],
  "limits": {
    "timeoutMilliseconds": 120000,
    "maxOutputBytes": 10485760
  }
}
