{
  "$schema": "../../schemas/benchmark.schema.json",
  "id": "shortest-path",
  "name": "Weighted shortest-path queries",
  "version": 1,
  "description": "Directed weighted graph shortest-path queries exercising priority queues, memory access, and branch-heavy workloads.",
  "inputFormat": "json",
  "outputFormat": "json",
  "checker": {
    "task": "shortest-path",
    "timeoutMilliseconds": 30000
  },
  "sizes": {
    "small": {
      "dataset": "small.json",
      "warmupIterations": 3,
      "measuredIterations": 10
    },
    "medium": {
      "dataset": "medium.json",
      "warmupIterations": 3,
      "measuredIterations": 10
    },
    "large": {
      "dataset": "large.json",
      "warmupIterations": 3,
      "measuredIterations": 10
    }
  },
  "metrics": ["kernelTime"],
  "limits": {
    "timeoutMilliseconds": 120000,
    "maxOutputBytes": 10485760
  }
}
